{
    "$schema": "http://json-schema.org/draft-04/schema#",
    "title": "Schema for an Open Contracting Release Package",
    "description": "Note that all releases within a release package must have a unique releaseID within this release package.",
    "type": "object",
    "required": ["uri", "publisher", "publishedDate", "releases"],
    "properties": {
        "uri": {
            "title": "Package Identifier",
            "description": "The URI of this package that identifies it uniquely in the world.",
            "type": "string",
            "format": "uri"
        },
        "publishedDate": {
            "description": "The date that this package was published. Ideally this should be the latest date that there is release information in this package.",
            "type": "string",
            "format": "date-time"
        },
        "releases": {
            "type": "array",
            "minItems": 1,
            "items": { "$ref": "http://ocds.open-contracting.org/standard/r/1__0__0/release-schema.json" },
            "uniqueItems": true
        },
        "publisher": { 
            "description": "Information to uniquely identify the publisher of this package.",
            "type": "object",
            "properties": {
                "name": {
                    "type": "string"
                },
                "scheme": {
                    "description": "The scheme that holds the unique identifiers used to identify the item being identified.",
                    "type": ["string", "null"],
                    "format": "uri"
                },
                "uid": {
                    "description": "The unique ID for this entity under the given ID scheme.",
                    "type": ["string", "null"]
                },
                "uri": {
                    "type": ["string", "null"],
                    "format" : "uri"
                }
            },
            "required": ["name"]
        },
        "license": {
            "description": "A link to the license that applies to the data in this datapackage. A Public Domain Dedication or [Open Definition Conformant](http://opendefinition.org/licenses/) license is strongly recommended. The canonical URI of the license should be used. Documents linked from this file may be under other license conditions. ",
            "type": ["string", "null"],
            "format": "uri"
        },
        "publicationPolicy": {
            "description": "A link to a document describing the publishers [publication policy](http://ocds.open-contracting.org/standard/r/1__0__0/en/implementation/publication_patterns/#publication-policy).",
            "type": ["string", "null"],
            "format": "uri"
        }
    }
}